{
  "commit": "3a146c81956994f90b84ab0673ba95ca1d5dcfcb",
  "contract": "manifest-v1",
  "manifest": {
    "id": 647169238,
    "name": "ond-0.2.0-manifest.json",
    "sha256": "b5d17aa284ffed49c2bb7a5e45abe19a00afb68c036a89949d28110d900fcb60",
    "size": 761
  },
  "releaseId": 414905200,
  "repository": "SUPER-SHRINE/ond",
  "repositoryId": 1404563628,
  "schemaVersion": 1,
  "tag": "0.2.0",
  "targets": [
    {
      "archive": {
        "id": 647168948,
        "name": "ond-0.2.0-linux-x86_64.tar.gz",
        "sha256": "9ad6bba2441fe34830d8024517145134779d47cf6d755517a14a8e6956ab30b4",
        "size": 3718058
      },
      "binary": {
        "name": "ond-lsp",
        "sha256": "7aa655e149cc50624f451805af3aee67fe3bef5876ddba96f134ba10ab1757d7"
      },
      "checksum": {
        "id": 647169010,
        "name": "ond-0.2.0-linux-x86_64.tar.gz.sha256",
        "sha256": "99b13effae2c47a55cdfe88d9ee562df01b97bacd0bc5cea634afad5ad18af0b",
        "size": 96
      },
      "rustTarget": "x86_64-unknown-linux-gnu",
      "target": "linux-x86_64"
    },
    {
      "archive": {
        "id": 647169068,
        "name": "ond-0.2.0-windows-x86_64.zip",
        "sha256": "4ff2a9e55bff40f249a6819f1ec1e78b69a249c8f8b41620cfb3f487dcc215a9",
        "size": 3405829
      },
      "binary": {
        "name": "ond-lsp.exe",
        "sha256": "8805efd8da337e7b73d97130fadb7f3c260226306bc3e991ebf71a2d6795ce95"
      },
      "checksum": {
        "id": 647169188,
        "name": "ond-0.2.0-windows-x86_64.zip.sha256",
        "sha256": "5833719129e8ced9cbf7f76e8e49f011a3fd6e2eb6630c3b0393fce3037bc230",
        "size": 96
      },
      "rustTarget": "x86_64-pc-windows-msvc",
      "target": "windows-x86_64"
    }
  ],
  "version": "0.2.0"
}
