{
  "commit": "ea50b0509f614167cdd912ce2393683f85c01560",
  "contract": "legacy-v1",
  "manifest": null,
  "releaseId": 402902423,
  "repository": "SUPER-SHRINE/ond",
  "repositoryId": 1404563628,
  "schemaVersion": 1,
  "tag": "0.1.1",
  "targets": [
    {
      "archive": {
        "id": 609379303,
        "name": "ond-0.1.1-linux-x86_64.tar.gz",
        "sha256": "585bb7d413d9193c92f69691d5b3829a82a674581a941212ad9380cb46b19c43",
        "size": 3564175
      },
      "binary": {
        "name": "ond-lsp",
        "sha256": "d3ea48e350a4cfc72536f5c0f504cdd49170df296658cf7b7c90302b9a93d84b"
      },
      "checksum": {
        "id": 609379300,
        "name": "ond-0.1.1-linux-x86_64.tar.gz.sha256",
        "sha256": "300ad06f679d316c749f5cb67268b531fc708f4e8f80d9fc6f80e1fcf761e711",
        "size": 96
      },
      "rustTarget": "x86_64-unknown-linux-gnu",
      "target": "linux-x86_64"
    },
    {
      "archive": {
        "id": 609379302,
        "name": "ond-0.1.1-windows-x86_64.zip",
        "sha256": "2ce5767df824966b94e3691d3f6d5df767d0912b65977f396d636478c720869a",
        "size": 3216252
      },
      "binary": {
        "name": "ond-lsp.exe",
        "sha256": "3042a4129557d1eb80d6e664c1682305e9e1cbb913dded6d22de60c7e1069c8b"
      },
      "checksum": {
        "id": 609379301,
        "name": "ond-0.1.1-windows-x86_64.zip.sha256",
        "sha256": "4450277ba3bbaf4731fbd4d64819d4f2a1ebe5a3fc1e793fa8317c7202592a22",
        "size": 96
      },
      "rustTarget": "x86_64-pc-windows-msvc",
      "target": "windows-x86_64"
    }
  ],
  "version": "0.1.1"
}
